{
  "schema_version": "1.0",
  "company_id": "U_DEMO_01",
  "client_type": "client",
  "ownership": "ЧАСТНАЯ СОБСТВЕННОСТЬ",
  "industry": {
    "okved_code": "46.38",
    "okved_name": "Торговля оптовая прочими пищевыми продуктами, включая рыбу, ракообразных и моллюсков",
    "section": "G",
    "segment": "food",
    "segment_name": "Продукты питания и напитки",
    "value_chain": "wholesale",
    "resolved_by": "code",
    "topics": [
      "inflation",
      "consumption",
      "trade",
      "regulation"
    ],
    "keywords": [
      "продукты питания",
      "продовольствие",
      "пищевая промышленность",
      "цены на продукты",
      "импорт продовольствия",
      "мясо",
      "рыба",
      "морепродукты",
      "молочная продукция",
      "напитки"
    ]
  },
  "scale": {
    "revenue_rub": 18200000000,
    "employees_band": "16-100",
    "age_band": "8-15",
    "lifecycle_stage": "Оптимизация",
    "is_large_business": true
  },
  "location": {
    "city": "г. Москва",
    "region": "Москва"
  },
  "products": [
    "settlement",
    "loan"
  ],
  "foreign_trade": {
    "has_customs_records": true,
    "countries": [
      "КИТАЙ",
      "ТУРЦИЯ"
    ]
  },
  "group": {
    "group_id": "group_demo_01",
    "companies_count": 12,
    "industries": [
      "Оптовая торговля",
      "Складское хозяйство"
    ]
  },
  "counterparties": [],
  "linked_persons_count": 1,
  "has_key_owner_mark": false,
  "market_position": {
    "peer_basis": "okved_code",
    "peer_count": 340,
    "revenue_rank": 3,
    "revenue_percentile": 0.99,
    "peer_revenue_share": 0.12
  },
  "features": [
    {
      "id": "feature:industry",
      "kind": "industry",
      "label": "Оптовая торговля пищевыми продуктами (ОКВЭД 46.38)",
      "value": "46.38",
      "source_fields": [
        "MAINOKVED_CODE",
        "MAINOKVED_NAME"
      ]
    },
    {
      "id": "feature:loan",
      "kind": "product",
      "label": "Пользуется кредитными продуктами банка",
      "value": true,
      "source_fields": [
        "CL_PRODUCT_LOA_MARK"
      ]
    },
    {
      "id": "feature:import",
      "kind": "foreign_trade",
      "label": "Ведёт внешнеэкономическую деятельность: Китай, Турция",
      "value": "КИТАЙ, ТУРЦИЯ",
      "source_fields": [
        "FTS_FLAG",
        "FTS_COUNTRY_NAME"
      ]
    },
    {
      "id": "feature:large",
      "kind": "scale",
      "label": "Крупный бизнес: выручка 18,2 млрд ₽",
      "value": 18200000000,
      "source_fields": [
        "REVENUE_COMPANY"
      ]
    },
    {
      "id": "feature:market-rank",
      "kind": "finance",
      "label": "3-е место по выручке среди 340 компаний отрасли в выгрузке",
      "value": 3,
      "source_fields": [
        "REVENUE_COMPANY",
        "MAINOKVED_CODE"
      ],
      "derived": true
    }
  ],
  "data_quality": {
    "missing_fields": [
      "AMOUNT_WORKERS_SPARK_GRADATION"
    ],
    "warnings": [
      "Платежей в выгрузке нет: контрагенты не определены"
    ]
  }
}
